{
  "_D": "urn:oasis:names:specification:ubl:schema:xsd:TransportExecutionPlanRequest-2",
  "_A": "urn:oasis:names:specification:ubl:schema:xsd:CommonAggregateComponents-2",
  "_B": "urn:oasis:names:specification:ubl:schema:xsd:CommonBasicComponents-2",
  "TransportExecutionPlanRequest": {
    "UBLVersionID": { "_": "2.1" },
    "ID": { "_": "TEPR_1" },
    "VersionID": { "_": "1" },
    "IssueDate": { "_": "2011-09-13" },
    "IssueTime": { "_": "10:00:10+01:00" },
    "DocumentStatusCode": { "_": "NotConfirmed" },
    "SenderParty": {
      "PartyIdentification": [
        {
          "ID": {
            "_": "4058673827000",
            "schemeAgencyName": "GS1",
            "schemeName": "GLN"
          }
        }
      ],
      "PartyName": [
        {
          "Name": { "_": "Consignor" }
        }
      ],
      "Contact": {
        "Name": { "_": "SomeName" },
        "Telephone": { "_": "+8687878763" },
        "ElectronicMail": { "_": "SomeName@consignor.cn" }
      }
    },
    "ReceiverParty": {
      "PartyIdentification": [
        {
          "ID": {
            "_": "4058673827641",
            "schemeAgencyName": "GS1",
            "schemeName": "GLN"
          }
        }
      ],
      "PartyName": [
        {
          "Name": { "_": "NECOSS" }
        }
      ],
      "Contact": {
        "Name": { "_": "SomeName" },
        "Telephone": { "_": "+49450557000" },
        "ElectronicMail": { "_": "SomeName@necoss.de" }
      }
    },
    "TransportUserParty": {
      "PartyIdentification": [
        {
          "ID": {
            "_": "4058673827000",
            "schemeAgencyName": "GS1",
            "schemeName": "GLN"
          }
        }
      ],
      "PartyName": [
        {
          "Name": { "_": "Consignor" }
        }
      ],
      "Contact": {
        "Name": { "_": "SomeName" },
        "Telephone": { "_": "+8687878763" },
        "ElectronicMail": { "_": "SomeName@consignor.cn" }
      }
    },
    "TransportServiceProviderParty": {
      "PartyIdentification": [
        {
          "ID": {
            "_": "4058673827641",
            "schemeAgencyName": "GS1",
            "schemeName": "GLN"
          }
        }
      ],
      "PartyName": [
        {
          "Name": { "_": "NECOSS" }
        }
      ],
      "Contact": {
        "Name": { "_": "SomeName" },
        "Telephone": { "_": "+49450557000" },
        "ElectronicMail": { "_": "SomeName@necoss.de" }
      }
    },
    "TransportServiceDescriptionDocumentReference": {
      "ID": { "_": "2" }
    },
    "TransportContract": {
      "Note": [{ "_": "Framework Agreement" }],
      "ContractDocumentReference": [
        {
          "ID": { "_": "TC101" },
          "IssueDate": { "_": "2010-01-01" },
          "DocumentTypeCode": { "_": "315" },
          "DocumentType": [{ "_": "Contract" }],
          "DocumentDescription": [
            { "_": "Framework Agreement between Consignor and NECOSS" }
          ]
        }
      ]
    },
    "TransportServiceProviderResponseDeadlinePeriod": [
      {
        "EndDate": { "_": "2011-09-13" },
        "EndTime": { "_": "11:00:10+01:00" }
      }
    ],
    "MainTransportationService": {
      "TransportServiceCode": { "_": "3" },
      "TransportationServiceDescription": [
        { "_": "Transport from Hamburg to Nurnberg" }
      ]
    },
    "ServiceEndTimePeriod": {
      "EndDate": { "_": "2011-10-06" },
      "EndTime": { "_": "16:00:10+01:00" }
    },
    "FromLocation": {
      "LocationTypeCode": { "_": "13" },
      "Address": {
        "ID": {
          "_": "DEHAM",
          "schemeAgencyName": "UN",
          "schemeName": "UN/LOCODE"
        },
        "StreetName": { "_": "Neuer Wandrahm 4" },
        "CityName": { "_": "Hamburg" },
        "PostalZone": { "_": "29400" },
        "Country": {
          "IdentificationCode": { "_": "DE" }
        }
      }
    },
    "ToLocation": {
      "LocationTypeCode": { "_": "7" },
      "Address": {
        "StreetName": { "_": "Grosse strasse 34" },
        "CityName": { "_": "Nurnberg" },
        "PostalZone": { "_": "28400" },
        "Country": {
          "IdentificationCode": { "_": "DE" }
        }
      }
    },
    "TransportExecutionTerms": {
      "DeliveryTerms": [
        {
          "ID": { "_": "EXW", "schemeAgencyName": "INCOTERMS" },
          "DeliveryLocation": {
            "Address": {
              "CityName": { "_": "Hamburg" }
            }
          }
        }
      ],
      "NotificationRequirement": [
        {
          "NotificationTypeCode": { "_": "TIME_SCHEDULE_DEVIATIONS" },
          "NotifyParty": [
            {
              "EndpointID": { "_": "www.consignee.de/statusnotifications/" },
              "PartyName": [
                {
                  "Name": { "_": "Consignee" }
                }
              ],
              "Contact": {
                "ElectronicMail": { "_": "someName@consignee.de" }
              }
            },
            {
              "EndpointID": { "_": "www.consignor.cn/statusnotifications/" },
              "PartyName": [
                {
                  "Name": { "_": "Consignor" }
                }
              ],
              "Contact": {
                "ElectronicMail": { "_": "someName@consignor.cn" }
              }
            }
          ]
        },
        {
          "NotificationTypeCode": { "_": "ITEM_CONDITION_DEVIATIONS" },
          "PostEventNotificationDurationMeasure": {
            "_": 10,
            "unitCode": "MIN"
          },
          "NotifyParty": [
            {
              "EndpointID": { "_": "www.consignee.com/statusnotifications/" },
              "PartyName": [
                {
                  "Name": { "_": "Consignee" }
                }
              ],
              "Contact": {
                "ElectronicMail": { "_": "someName@consignee.de" }
              }
            },
            {
              "EndpointID": { "_": "www.consignor.cn/statusnotifications/" },
              "PartyName": [
                {
                  "Name": { "_": "Consignor" }
                }
              ],
              "Contact": {
                "ElectronicMail": { "_": "someName@consignor.cn" }
              }
            }
          ]
        }
      ]
    },
    "Consignment": [
      {
        "ID": { "_": "CON_1" },
        "GrossWeightMeasure": { "_": 50000, "unitCode": "KGM" },
        "NetWeightMeasure": { "_": 3000, "unitCode": "KGM" },
        "GrossVolumeMeasure": { "_": 78, "unitCode": "MTQ" },
        "LoadingLengthMeasure": { "_": 12, "unitCode": "MTR" },
        "HazardousRiskIndicator": { "_": false },
        "TotalTransportHandlingUnitQuantity": { "_": 2 },
        "ConsolidatedShipment": [
          {
            "ID": { "_": "GSIN_1" }
          },
          {
            "ID": { "_": "GSIN_2" }
          }
        ],
        "RequestedPickupTransportEvent": {
          "Location": {
            "Address": {
              "ID": {
                "_": "DEHAM",
                "schemeAgencyName": "UN",
                "schemeName": "UN/LOCODE"
              },
              "StreetName": { "_": "Neuer Wandrahm 4" },
              "CityName": { "_": "Hamburg" },
              "PostalZone": { "_": "29400" },
              "Country": {
                "IdentificationCode": { "_": "DE" }
              }
            }
          },
          "Period": [
            {
              "StartDate": { "_": "2011-10-03" },
              "StartTime": { "_": "09:30:10+01:00" },
              "EndDate": { "_": "2011-10-03" },
              "EndTime": { "_": "12:30:10+01:00" }
            }
          ]
        },
        "RequestedDeliveryTransportEvent": {
          "Location": {
            "Address": {
              "StreetName": { "_": "Grosse strasse 34" },
              "CityName": { "_": "Nurnberg" },
              "PostalZone": { "_": "28400" },
              "Country": {
                "IdentificationCode": { "_": "DE" }
              }
            }
          },
          "Period": [
            {
              "StartDate": { "_": "2011-10-06" },
              "StartTime": { "_": "12:30:10+01:00" },
              "EndDate": { "_": "2011-10-06" },
              "EndTime": { "_": "15:30:10+01:00" }
            }
          ]
        },
        "ConsigneeParty": {
          "PartyIdentification": [
            {
              "ID": {
                "_": "4058673827123",
                "schemeAgencyName": "GS1",
                "schemeName": "GLN"
              }
            }
          ],
          "PartyName": [
            {
              "Name": { "_": "Consignee" }
            }
          ],
          "Contact": {
            "Name": { "_": "SomeName" },
            "Telephone": { "_": "+4987878763" },
            "ElectronicMail": { "_": "SomeName@consignee.de" }
          }
        },
        "ConsignorParty": {
          "PartyIdentification": [
            {
              "ID": {
                "_": "4058673827000",
                "schemeAgencyName": "GS1",
                "schemeName": "GLN"
              }
            }
          ],
          "PartyName": [
            {
              "Name": { "_": "Consignor" }
            }
          ],
          "PostalAddress": {
            "ID": {
              "_": "4058673827000",
              "schemeAgencyName": "GS1",
              "schemeName": "GLN"
            }
          },
          "Contact": {
            "Name": { "_": "SomeName" },
            "Telephone": { "_": "+8676576456" },
            "ElectronicMail": { "_": "SomeName@consignor.cn" }
          }
        },
        "OriginalDepartureCountry": {
          "IdentificationCode": { "_": "CN" }
        },
        "FinalDestinationCountry": {
          "IdentificationCode": { "_": "DE" }
        },
        "TransportHandlingUnit": [
          {
            "ID": { "_": "CON_THU_1" },
            "TransportHandlingUnitTypeCode": { "_": "4" },